<?xml version="1.0" encoding="UTF-8"?>

<TiemThuoc xmlns:xsi="http://www.w3.org/2001/XMLSchema-instance" xsi:noNamespaceSchemaLocation="tiemthuoc.xsd">
    <!-- ====== LOAI THUOC ====== -->
    <LoaiThuoc>
        <MaLoai>L01</MaLoai>
        <TenLoai>Giảm đau</TenLoai>
        <MoTa>Dùng để giảm đau nhẹ</MoTa>
    </LoaiThuoc>
    <LoaiThuoc>
        <MaLoai>L02</MaLoai>
        <TenLoai>Kháng sinh</TenLoai>
        <MoTa>Điều trị nhiễm khuẩn</MoTa>
    </LoaiThuoc>
    <LoaiThuoc>
        <MaLoai>L03</MaLoai>
        <TenLoai>Vitamin</TenLoai>
        <MoTa>Bổ sung dinh dưỡng</MoTa>
    </LoaiThuoc>
    <LoaiThuoc>
        <MaLoai>L04</MaLoai>
        <TenLoai>Hạ sốt</TenLoai>
        <MoTa>Giúp hạ thân nhiệt</MoTa>
    </LoaiThuoc>
    <LoaiThuoc>
        <MaLoai>L05</MaLoai>
        <TenLoai>Tiêu hóa</TenLoai>
        <MoTa>Hỗ trợ tiêu hóa</MoTa>
    </LoaiThuoc>
    <LoaiThuoc>
        <MaLoai>L06</MaLoai>
        <TenLoai>Đau đầu</TenLoai>
        <MoTa>Giảm các cơn đau đầu nhẹ</MoTa>
    </LoaiThuoc>
    <LoaiThuoc>
        <MaLoai>L07</MaLoai>
        <TenLoai>Kháng viêm</TenLoai>
        <MoTa>Giúp ngăn ngừa các loại viêm nhiễm</MoTa>
    </LoaiThuoc>
    <LoaiThuoc>
        <MaLoai>L08</MaLoai>
        <TenLoai>Ho Cảm cúm</TenLoai>
        <MoTa>Giảm ho và triệu chứng cảm cúm</MoTa>
    </LoaiThuoc>
    <LoaiThuoc>
        <MaLoai>L09</MaLoai>
        <TenLoai>Tim mạch</TenLoai>
        <MoTa>Điều trị bệnh liên quan đến tim mạch</MoTa>
    </LoaiThuoc>

    <!-- ====== KE THUOC ====== -->
    <KeThuoc>
        <MaKe>K01</MaKe>
        <SoLuong>100</SoLuong>
        <MaLoaiThuoc>L01</MaLoaiThuoc>
        <TrangThai>Đang sử dụng</TrangThai>
        <MaThuoc>T01</MaThuoc>
    </KeThuoc>
    <KeThuoc>
        <MaKe>K02</MaKe>
        <SoLuong>150</SoLuong>
        <MaLoaiThuoc>L02</MaLoaiThuoc>
        <TrangThai>Đang sử dụng</TrangThai>
        <MaThuoc>T02</MaThuoc>
    </KeThuoc>
    <KeThuoc>
        <MaKe>K03</MaKe>
        <SoLuong>80</SoLuong>
        <MaLoaiThuoc>L03</MaLoaiThuoc>
        <TrangThai>Đang sử dụng</TrangThai>
        <MaThuoc>T03</MaThuoc>
    </KeThuoc>
    <KeThuoc>
        <MaKe>K04</MaKe>
        <SoLuong>60</SoLuong>
        <MaLoaiThuoc>L04</MaLoaiThuoc>
        <TrangThai>Tạm ngưng</TrangThai>
        <MaThuoc>T04</MaThuoc>
    </KeThuoc>
    <KeThuoc>
        <MaKe>K05</MaKe>
        <SoLuong>90</SoLuong>
        <MaLoaiThuoc>L05</MaLoaiThuoc>
        <TrangThai>Đang sử dụng</TrangThai>
        <MaThuoc>T05</MaThuoc>
    </KeThuoc>
    <KeThuoc>
        <MaKe>K06</MaKe>
        <SoLuong>120</SoLuong>
        <MaLoaiThuoc>L06</MaLoaiThuoc>
        <TrangThai>Đang sử dụng</TrangThai>
        <MaThuoc>T06</MaThuoc>
    </KeThuoc>
    <KeThuoc>
        <MaKe>K07</MaKe>
        <SoLuong>110</SoLuong>
        <MaLoaiThuoc>L07</MaLoaiThuoc>
        <TrangThai>Đang sử dụng</TrangThai>
        <MaThuoc>T07</MaThuoc>
    </KeThuoc>

    <!-- ====== THUOC ====== -->
    <Thuoc>
        <MaThuoc>T01</MaThuoc>
        <TenThuoc>Paracetamol</TenThuoc>
        <HanSuDung>2026-06-01</HanSuDung>
        <DonViTinh>Viên</DonViTinh>
        <Gia>5000</Gia>
        <SoLuongTon>200</SoLuongTon>
    </Thuoc>
    <Thuoc>
        <MaThuoc>T02</MaThuoc>
        <TenThuoc>Amoxicillin</TenThuoc>
        <HanSuDung>2026-03-01</HanSuDung>
        <DonViTinh>Viên</DonViTinh>
        <Gia>7000</Gia>
        <SoLuongTon>150</SoLuongTon>
    </Thuoc>
    <Thuoc>
        <MaThuoc>T03</MaThuoc>
        <TenThuoc>Vitamin C</TenThuoc>
        <HanSuDung>2027-01-01</HanSuDung>
        <DonViTinh>Viên</DonViTinh>
        <Gia>3000</Gia>
        <SoLuongTon>300</SoLuongTon>
    </Thuoc>
    <Thuoc>
        <MaThuoc>T04</MaThuoc>
        <TenThuoc>Ibuprofen</TenThuoc>
        <HanSuDung>2026-09-01</HanSuDung>
        <DonViTinh>Viên</DonViTinh>
        <Gia>8000</Gia>
        <SoLuongTon>180</SoLuongTon>
    </Thuoc>
    <Thuoc>
        <MaThuoc>T05</MaThuoc>
        <TenThuoc>Smecta</TenThuoc>
        <HanSuDung>2027-02-01</HanSuDung>
        <DonViTinh>Gói</DonViTinh>
        <Gia>9000</Gia>
        <SoLuongTon>120</SoLuongTon>
    </Thuoc>
    <Thuoc>
        <MaThuoc>T06</MaThuoc>
        <TenThuoc>Decolgen</TenThuoc>
        <HanSuDung>2026-12-01</HanSuDung>
        <DonViTinh>Viên</DonViTinh>
        <Gia>6000</Gia>
        <SoLuongTon>220</SoLuongTon>
    </Thuoc>
    <Thuoc>
        <MaThuoc>T07</MaThuoc>
        <TenThuoc>Atorvastatin</TenThuoc>
        <HanSuDung>2027-05-01</HanSuDung>
        <DonViTinh>Viên</DonViTinh>
        <Gia>15000</Gia>
        <SoLuongTon>130</SoLuongTon>
    </Thuoc>

    <!-- ====== NHA CUNG CAP ====== -->
    <NhaCungCap>
        <MaNCC>NCC01</MaNCC>
        <TenNCC>CTY Dược Trung Ương</TenNCC>
        <DiaChi>Hà Nội</DiaChi>
        <SDT>0901234567</SDT>
    </NhaCungCap>
    <NhaCungCap>
        <MaNCC>NCC02</MaNCC>
        <TenNCC>Dược Hậu Giang</TenNCC>
        <DiaChi>Cần Thơ</DiaChi>
        <SDT>0902234567</SDT>
    </NhaCungCap>
    <NhaCungCap>
        <MaNCC>NCC03</MaNCC>
        <TenNCC>Pharma Bình Dương</TenNCC>
        <DiaChi>Bình Dương</DiaChi>
        <SDT>0903234567</SDT>
    </NhaCungCap>
    <NhaCungCap>
        <MaNCC>NCC04</MaNCC>
        <TenNCC>CTY CP Dược An Khang</TenNCC>
        <DiaChi>TP.HCM</DiaChi>
        <SDT>0904234567</SDT>
    </NhaCungCap>
    <NhaCungCap>
        <MaNCC>NCC05</MaNCC>
        <TenNCC>CTY CP Dược Phúc An</TenNCC>
        <DiaChi>Đà Nẵng</DiaChi>
        <SDT>0905234567</SDT>
    </NhaCungCap>
    <NhaCungCap>
        <MaNCC>NCC06</MaNCC>
        <TenNCC>CTY Dược Sài Gòn</TenNCC>
        <DiaChi>TP.HCM</DiaChi>
        <SDT>0906234567</SDT>
    </NhaCungCap>
    <NhaCungCap>
        <MaNCC>NCC07</MaNCC>
        <TenNCC>Dược Nam Hà</TenNCC>
        <DiaChi>Nam Định</DiaChi>
        <SDT>0907234567</SDT>
    </NhaCungCap>

    <!-- ====== PHIEU NHAP ====== -->
    <PhieuNhap>
        <MaPhieuNhap>PN01</MaPhieuNhap>
        <MaNCC>NCC01</MaNCC>
        <NgayNhap>2025-09-25</NgayNhap>
        <TongTien>450000</TongTien>
    </PhieuNhap>
    <PhieuNhap>
        <MaPhieuNhap>PN02</MaPhieuNhap>
        <MaNCC>NCC02</MaNCC>
        <NgayNhap>2025-10-01</NgayNhap>
        <TongTien>530000</TongTien>
    </PhieuNhap>
    <PhieuNhap>
        <MaPhieuNhap>PN03</MaPhieuNhap>
        <MaNCC>NCC01</MaNCC>
        <NgayNhap>2025-10-01</NgayNhap>
        <TongTien>330000</TongTien>
    </PhieuNhap>
    <PhieuNhap>
        <MaPhieuNhap>PN04</MaPhieuNhap>
        <MaNCC>NCC03</MaNCC>
        <NgayNhap>2025-10-02</NgayNhap>
        <TongTien>330000</TongTien>
    </PhieuNhap>
    <PhieuNhap>
        <MaPhieuNhap>PN05</MaPhieuNhap>
        <MaNCC>NCC04</MaNCC>
        <NgayNhap>2025-10-03</NgayNhap>
        <TongTien>500000</TongTien>
    </PhieuNhap>
    <PhieuNhap>
        <MaPhieuNhap>PN06</MaPhieuNhap>
        <MaNCC>NCC05</MaNCC>
        <NgayNhap>2025-10-04</NgayNhap>
        <TongTien>700000</TongTien>
    </PhieuNhap>
    <PhieuNhap>
        <MaPhieuNhap>PN07</MaPhieuNhap>
        <MaNCC>NCC06</MaNCC>
        <NgayNhap>2025-10-05</NgayNhap>
        <TongTien>650000</TongTien>
    </PhieuNhap>
    <!-- CHI TIẾT PHIẾU NHẬP -->
    <ChiTietPhieuNhap>
        <MaPhieuNhap>PN01</MaPhieuNhap>
        <MaThuoc>T01</MaThuoc>
        <SoLuong>50</SoLuong>
        <ThanhTien>250000</ThanhTien>
    </ChiTietPhieuNhap>

    <ChiTietPhieuNhap>
        <MaPhieuNhap>PN02</MaPhieuNhap>
        <MaThuoc>T02</MaThuoc>
        <SoLuong>40</SoLuong>
        <ThanhTien>280000</ThanhTien>
    </ChiTietPhieuNhap>
    <ChiTietPhieuNhap>
        <MaPhieuNhap>PN03</MaPhieuNhap>
        <MaThuoc>T03</MaThuoc>
        <SoLuong>40</SoLuong>
        <ThanhTien>280000</ThanhTien>
    </ChiTietPhieuNhap>
    <ChiTietPhieuNhap>
        <MaPhieuNhap>PN07</MaPhieuNhap>
        <MaThuoc>T06</MaThuoc>
        <SoLuong>20</SoLuong>
        <ThanhTien>280000</ThanhTien>
    </ChiTietPhieuNhap>
    <ChiTietPhieuNhap>
        <MaPhieuNhap>PN04</MaPhieuNhap>
        <MaThuoc>T04</MaThuoc>
        <SoLuong>22</SoLuong>
        <ThanhTien>285000</ThanhTien>
    </ChiTietPhieuNhap>
    <ChiTietPhieuNhap>
        <MaPhieuNhap>PN05</MaPhieuNhap>
        <MaThuoc>T07</MaThuoc>
        <SoLuong>111</SoLuong>
        <ThanhTien>3500000</ThanhTien>
    </ChiTietPhieuNhap>
    <ChiTietPhieuNhap>
        <MaPhieuNhap>PN06</MaPhieuNhap>
        <MaThuoc>T07</MaThuoc>
        <SoLuong>100</SoLuong>
        <ThanhTien>3500000</ThanhTien>
    </ChiTietPhieuNhap>

    <!-- ====== KHACH HANG ====== -->
    <KhachHang>
        <MaKH>KH01</MaKH>
        <HoTen>Nguyen Van A</HoTen>
        <SDT>0981234567</SDT>
        <GioiTinh>1</GioiTinh>
        <NgaySinh>1990-05-15</NgaySinh>
    </KhachHang>
    <KhachHang>
        <MaKH>KH02</MaKH>
        <HoTen>Tran Thi B</HoTen>
        <SDT>0982345678</SDT>
        <GioiTinh>0</GioiTinh>
        <NgaySinh>1995-10-12</NgaySinh>
    </KhachHang>
    <KhachHang>
        <MaKH>KH03</MaKH>
        <HoTen>Le Van C</HoTen>
        <SDT>0983456789</SDT>
        <GioiTinh>1</GioiTinh>
        <NgaySinh>1988-02-22</NgaySinh>
    </KhachHang>
    <KhachHang>
        <MaKH>KH04</MaKH>
        <HoTen>Pham Thi D</HoTen>
        <SDT>0984567890</SDT>
        <GioiTinh>0</GioiTinh>
        <NgaySinh>1992-03-30</NgaySinh>
    </KhachHang>
    <KhachHang>
        <MaKH>KH05</MaKH>
        <HoTen>Do Van E</HoTen>
        <SDT>0985678901</SDT>
        <GioiTinh>1</GioiTinh>
        <NgaySinh>1985-08-09</NgaySinh>
    </KhachHang>
    <KhachHang>
        <MaKH>KH06</MaKH>
        <HoTen>Nguyen Thi F</HoTen>
        <SDT>0986789012</SDT>
        <GioiTinh>0</GioiTinh>
        <NgaySinh>1998-12-10</NgaySinh>
    </KhachHang>
    <KhachHang>
        <MaKH>KH07</MaKH>
        <HoTen>Le Van G</HoTen>
        <SDT>0987890123</SDT>
        <GioiTinh>1</GioiTinh>
        <NgaySinh>1989-04-04</NgaySinh>
    </KhachHang>

    <!-- ====== HOA DON ====== -->
    <HoaDon>
        <MaHoaDon>HD01</MaHoaDon>
        <NgayLap>2025-10-01</NgayLap>
        <TongTien>50000</TongTien>